{
  "contract": "watchdog_policy_decision",
  "version": "v1",
  "decision_id": "wpd:case:hyp:gc:45:2026-03-15T11:45:00Z",
  "policy_id": "watchdog-policy:kernel:v1",
  "case_id": "case:hyp:gc:45",
  "scope": "kernel_exchange",
  "action": "allow",
  "highest_verdict": "pass",
  "blocked": false,
  "reasons": [],
  "exchange_ids": [
    "kx:real-case-remote-workflow:observed_state",
    "kx:real-case-remote-workflow:expected_state",
    "kx:real-case-remote-workflow:contradiction"
  ],
  "timestamp": "2026-03-15T11:45:00Z"
}